{
  "schema": 1,
  "platform": "linux-arm64",
  "version": "26.2.3.4",
  "channel": "lts",
  "build": "20260203.000004",
  "library": "libchtypes.so",
  "library_sha256": "33e8e429e8e21586e445d779fc5520cc5d6a254e0f67853f14757f3844b8d5f6",
  "library_bytes": 87,
  "digests": {
    "index": null,
    "manifest": "sha256:6b7ff7da89e19c3a4ed3472b5e6d5ee4419caa231e1a2b52ff1a39263bb10d7c",
    "layer": "sha256:0a2afb2a66a9259c84b31f58ec1ef90ac8ce0e84f34041e689364e32186675d3",
    "bundle": "sha256:b105f7b674cf89662ee8584da4162126ea1ce57b8f8aa2361e9360aae37353ad",
    "bundle_manifest": "sha256:c0b531ed756da82796172956484ea9237775fc9cede50b90774a6a97c6cfb024"
  },
  "signed_by": "6c3468e4ec653ac0",
  "predicate": {
    "abi": 1,
    "abi_fingerprint": "sha256:c4415089873be7cea12b2626f8393db654ce1213803b6ecd6c88c4db52402551",
    "clickhouse_version": "26.2.3.4",
    "channel": "lts",
    "clickhouse_minor": "26.2",
    "clickhouse_commit": "5ee40d5d9f429e2825737e0cb38add83de9aa348",
    "os": "linux",
    "arch": "arm64",
    "build": "20260203.000004",
    "core_commit": "723a7a2fa86498975b7dbb7147f5cfbf78af2555",
    "inputs_sha256": "4b51ab37e1a269ced124541a0bdbc5a4800eb4b1d86b8940c7202b20c198f45e",
    "library": "libchtypes.so",
    "library_sha256": "33e8e429e8e21586e445d779fc5520cc5d6a254e0f67853f14757f3844b8d5f6",
    "library_bytes": 87,
    "glibc_floor": "2.17"
  }
}
